"im2txt_low","subject matter is wrong","the description describes something that isn't there","It should depict what is there."
"im2txt_low","The focus is on the middle of the screen","There are not two columns and there are no videos, just a picture","They could say this is an app for showing off your art work and talk about how it displays the art in the middle window. They could mention the back button in the top corner"
"im2txt_low","I think the first three paragraphs are accurate enough","The first two paragraphs of Section 1 are not accurate enough because it contains some redundancies (e.g. the bracket in the first paragraph) and some grammatical errors.","It could be improved by removing the redundancies and performing a grammar check."
"im2txt_low","There is a space to enter email","Where the box is located","State the box is near the top of the screen"
"im2txt_low","none - there is no such field","all - there is no such field","write an accurate description"
"im2txt_low","It correctly states there is a field for inputting an email address.","The field isn't really in the center of the screen like the description says.","It could say ""at the bottom of the screen"" or ""the last field"" instead of ""in the center of the screen."""
"im2txt_low","None","There is not line for an email address on the page, let alone in the center as described","This page asks for general user information including weight, sex and desired water consumption. There is  pop up that shows the user has selected the female option."
"im2txt_low","There is in fact an input for an email.","It's more top-center than proper center where they want you to input the email.","Say that it's a login for Facebook."
"im2txt_low","There is a way to get started with the app at the bottom of the screen.","no inaccuracies.","A terms and conditions agreement could also be mentioned."
"im2txt_low","That there is a back button at the top left corner","Nothing","Nothing"
"im2txt_low","It is not accurate","There is no place for an email","This is a help screen"
"im2txt_low","I can't be entirely sure the description is accurately depicting the button at the top right's description as I don't know the website, but there is a button at the top right of the screen","As far as I know, it's accurate.","It's fine, unless that button means something else entirely."
"im2txt_low","button menu top left corner","all accurate","it is very accurate"
"im2txt_low","In the top left hand corner of the screen there does appear to be a button that can be clicked on, so that is accurate.","However, the button seems to be described inaccurately as a ""back button"", when in actuality is appears to be a button that when pressed causes a drop-down menu to appear.","The description could be changed to better describe what the button actually does, as it appears to be inaccurate in this regard."
"im2txt_low","you can input something","it is not an email address you enter","change it to ""life miles number"""
"im2txt_low","There is nothing correct about this description.","There is no text field for a user to enter their name.","By saying, ""This page displays the perks to using Smartlock, and offers the ability to enable Smartlock using the 'Enable' button that is set at the bottom of the page.""."
"im2txt_low","None","There is no button in the top left corner","The description should be completed so the user knows what the function is"
"im2txt_low","There is log in field in the middle of the screen.","nothing","adding there is a log in field and then scroll down to the bottom of the page to submit."
"im2txt_low","It does have an e-mail entry in the middle of the box.","It is all accurate.","There are some other boxes and more information given in the screenshot."
"im2txt_low","None of it, as the description is not accurately describing what is on the screen.","There are no scrolling videos nor a list anywhere on the screenshot.","It could say ""In the middle of the screen is a welcome text field for the user which describes what to do should they need help""."
"im2txt_low","There is a button at the bottom of the page to log in.","The description is accurate, but the screen shot shows the home page.","By mentioning that the user is able to log in with Google or Facebook, or they register if they haven't."
"im2txt_low","All of them","None.","It can't."
"im2txt_low","There is a back button as the description states.","The description is incomplete and doesn't address the actual point of the screen.","This is the advanced settings screen on which the user can adjust settings."
"im2txt_low","There is a field to input the email address.","The description does not describe the full screen","This is a login or sign in page which has fields for inserting your name, email address or logging in with facebook or google."
"im2txt_low","That their is a button in the top right corner of the screen.","That the button is a ""further options"" button. It also fails to mention that this screen is one that allows the user to view and select among photo albums.","It should mention that the screen allows the user to select from a number of options of photo albums."
"im2txt_low","What is shown precedes account creation","""there is a button that lets the user create an account"" is not true, it is a Next button","By describing this as a preview of the app and the button as next not create an account"
"im2txt_low","That something is in the center of the screen .","The item in the center of the screen is a date selector not a text input area.","By either describing what is shown, or substituting a capture of the actual name input screen."
"im2txt_low","None.","The center does not say to add email address.","The center need to say, email address."
"im2txt_low","there is an email input field in the screenshot","nothing","add how you are prompted to select a language"
"im2txt_low","there is a field to enter your email address","it's not in the center of the screen","this screen let's you enter your email address to sign up for this app and receive a password"
"im2txt_low","The sentence is correct.","It doesn't necessarily exit the screen, but rather exits the pop up box.","Specifying that it exits the dialog box rather than the entire screen."
"im2txt_low","none, the field is labelled ""gender"" with checkboxes for male and female.","All aspects are inaccurate, as it refers to a different field than the one shown.","Make the description match the actual box shown."
"im2txt_low","nothing is accurate","all. there is no text screen and no place to enter information","describe what is actually in the screen shot"
"im2txt_low","Text field for email input.","The center of the screen is the password input.","The exact location of the email textbox could be explained better."
"im2txt_low","There is definitely a list which could be on a menu button page","There is no menu button in the top left corner","It needs to mention the Add Features for the Ear Spy"
"im2txt_low","There is a icon in the top left corner that allows the user to go backwards.","Nothing, it is accurate.","Describe the icon (a white arrow on a green background)"
"im2txt_low","There is a button to exit, but it is not on the bottom.","There is no exit button on the bottom.","Accurately saying where the exit button is."
"im2txt_low","There is text in the center of the screenshot of the app.","There is no field in the screenshot which allows me to enter my name.","The screenshot could accurately reflect what is written in the description."
"im2txt_low","none","I don't see anything at the top that allows you to go back","it can say the bottom of the screen"
"im2txt_low","in the top left hand corner there is a button that the user can click to take them","information is missing","in the top left hand corner there is a button that the user can click to take them back to the previous screen."
"im2txt_low","Some information is in the center of the screen.","There is not an area to enter your email address as stated.","Have an area to enter your information, then say where it is in reality."
"im2txt_low","The definition of the screenshot","None","None"
"im2txt_low","In the middle of the screen","lets the user exit the app","accuracy"
"im2txt_low","There is a button as described.","There are some punctuation errors only.","Use full stops and capital letters."
"im2txt_low","All of it","None of it","Say log in or create an account"
"im2txt_low","There is a back button in that location.","nothing is inaccurate.","Say what the back button goes to."
"im2txt_low","There is a button that would close the shown box in the screenshot.","The description does not mention the contents of the box which allows setting of a date.","By adding that the box shown allows the user to input the correct date, through a calendar or scroll box, and to click on ""Done"" to close the box."
"im2txt_low","None of it.","All of it.","Accurately describing the screenshot."
"im2txt_low","that there is an arrow link button at the top left corner","nothing","good enough"
"im2txt_low","none","all of it","by stating correctly what the text field is for"
"im2txt_low","The description provided is completely inaccurate.","The center of the screen doesn't display a text field to input ones email address.","Change the description to accurately depict what exactly is being displayed on the screen. This is related to accepting the terms and conditions, and is a prompting the user to either accept or decline the terms and conditions."
"im2txt_low","There is something in the middle of the screen.","It's not a text field, it's a button to email support.","It should say that it's a button in the middle of the page that emails support."
"im2txt_low","There is a button at the bottom.","The button at the bottom would not lead me to think it allows a user create an account.","It should say ""click Next"" instead of ""create an account."" Make it more intuitive."
"im2txt_low","none","there is no place to put your name","put a place to put name"
"im2txt_low","Its true that you can enter your email into the sign in.","It says sign in and not to enter an email.","It should says enter email here instead of just sign in."
"im2txt_low","There is a list of items in the middle of the screen.","I don't see that the list is scrolling.","The description could state that in the middle of the screen it shows various food items."
"im2txt_low","It is in the center of the screen.","These are not options, but information.","Write ""information"" rather than options."
"im2txt_low","there is a link on the top left","nothing","nothing"
"im2txt_low","The pictures may scroll at some point","There doesn't seem to be a carousel to scroll","Say why you are login in or signing up for this program."
"im2txt_low","None of it is accurate.","All of it is not accurate.","Actually describe what is on the page."
"im2txt_low","There is a text field","It does not appear to be for email address","Replace email address with the correct descriptor."
"im2txt_low","I did not find anything to be accurate.","There is no box in the middle of the screen, there are no instructions to provide an email address.","This description needs to be completely rewritten to reflect what is really on the screen."
"im2txt_low","It does describe where the menu button is.","Nothing","It could describe more."
"im2txt_low","There is a text field in the middle of the screen.","The text box does not let users input their name.","You could improve this description by saying that the text box in the middle shows users different styles of fonts."
"im2txt_low","It allows you to enter an email address and password.","There is no button at the bottom of the screen to exit the screen, unless you want to come back later to enter the information.","It could be clearer with directions and what this app is going to be used for. It could give the user more information."
"im2txt_low","There appears to be a scrolling list of something in 2 columns.","I can't tell if the list is videos or something else.","It needs to say there's a scrolling list of icons which, when selected, are videos."
"im2txt_low","There is a symbol in the middle of the screen","The symbol looks like buffering, not an exit button","State that the symbol in the middle of the screen is a gradient circle similar to loading screen."
"im2txt_low","None, there is nowhere to enter an email address.","All of the description is inaccurate because there is nowhere to enter an email address.","I would describe this screen as allowing the user to set the duration of a timer."
"im2txt_low","none","all","this screen displays icons to access different My Space sceens"
"im2txt_low","There are a few text fields - just not for emails","The description tells us that we can input our emails in a text field at the center of the screen but the text fields are used for other purposes","Change emails in the description to due dates"
"im2txt_low","I believe the description is accurate.","The ""link"" at top of display doesn't look like a button so that is confusing.","The link (button) at top left is for that page's menu."
"im2txt_low","None.","There is no input fields.","This screen allows you to manage the taking of medication."
"im2txt_low","There are buttons on the bottom and I'm sure one can be used to create an account.","None.  Although I'm not sure which button to push on to create the account.","There are 4 places that look like they can be touched to go to other things so not sure which button it is that should be used to create an account."
"im2txt_low","There is an area where people can sign up with their email.","All are accurate.","It should include that it's a login for Care.com as well."
"im2txt_low","The description is completely inaccurate.","There is no text field displayed on the screen.","By stating ""The screen displays the time and location details of an event, and has a button that allows the user to view details of that event."""
"im2txt_low","That it is a list of things","Everything is accurate","No improvement needed."
