"im2txt_combined","There is a link button at the top of the page that would take the user to the menu.","The link button to the menu is NOT on the left side of the screen, but on the right.","The description needs to state that the menu button consists of three dots in a row, and it is located in the top right side of the screen."
"im2txt_combined","I see a country at the top in the center","i cant tell if it is scrolling or not","it should be more accurate  its impossible to tell if the countries scroll or if that is the only country listed at the too"
"im2txt_combined","There is a button to sign in at the bottom of the screen.","The directions say sign in but the button says get started.","Indicate there is a button to get started at the bottom of the screen."
"im2txt_combined","None of the aspects.","There is no where to enter an email address.","If it described what is in the picture."
"im2txt_combined","There is a text field that allows the user to input their password.","The text box is not really in the center.","The area of the screen that the text field is located could be more accurate."
"im2txt_combined","NONE","THAT THERE IS A BUTTON IN THE MIDDLE OF THE SCREEN TO EXIT","TO SAY SOMETHING THAT IS ACCURATE AND VALUABLE"
"im2txt_combined","none","all aspects","it could describe all parts of the screen"
"im2txt_combined","No parts are accurate","There is not a link button in the top left corner","They could mention it is for the app DailyFunny or talk about the history functionality"
"im2txt_combined","All aspects are accurate","No aspect is inaccurate","A descriptive text or image telling the user what is going on"
"im2txt_combined","There is a back button but not where the description states","where the button is located","change it to top left corner"
"im2txt_combined","none there is no button.","all - there is no button","write a description that is not totally inaccurate"
"im2txt_combined","It is an Accept button, not an exit.","Everything - it not a way to exit the screen (unless the user accepts).","It should say that this is a button to accept, not exit the screen."
"im2txt_combined","None","There is no line for an email address.","Include that there is a description of the Emoji Party app in addition to a way to rate the app, contact the creators, purchase additional content and consult the terms and privacy policy of the app"
"im2txt_combined","None of it.","It describes where you can input an email address, but, the screenshot isn't for an email address.","Describe that it's for searching for a power school either through district/school or server address."
"im2txt_combined","nothing is accurate about the description","all of it.  there is no button that lets you exit the screen.","Accurately describe the screenshot, because the description and screenshot do not match."
"im2txt_combined","There is a place for someone to put their email","It doesn't include the sections about the sex and DOB on the page","Involving all of the parts found on the screen"
"im2txt_combined","There is a button on the bottom","The button is not to sign in, but to sign up","The button on the bottom allows you to sign up"
"im2txt_combined","The arrow described is in the correct location.","Description is accurate.","At the top left corner, there is an arrow link button to go to the previous page."
"im2txt_combined","middle of the screen exit allows user","all accurate","it could be improved by more accurately describing button functionality"
"im2txt_combined","There is a button in the top left of the screen, so that is an accurate part of the description.","The button in the top left of the screen appears to be a back button, not a link to a menu for the page, so that seems to be an inaccuracy.","It could be better explained what the button in the top left does, as I think the information in the description is incorrect."
"im2txt_combined","There a screen","there is no back button","describe the actual screen"
"im2txt_combined","There are no aspects of this description that are accurate.","That there is a button at the bottom of the screen to start the game.","Instead say, ""At the bottom of the screen, there are button options that allow the user to choose if they are searching for 'Small Pets', 'All Pets', or 'News & Views'."""
"im2txt_combined","That there is a button in the center of the page to enter in your information","none","It is okay"
"im2txt_combined","nothing","There is a button on the bottom to sign in","By describing the enable button."
"im2txt_combined","nothing is accurate.","there is nothing in the center that lets you see a scrolling list of countries.","Explain that this is an upload image screen."
"im2txt_combined","None of it, as this is not a text field for people to input an email address.","The whole thing as the description states inaccurate information related to whats actually on the screen.","It could say ""There is a text field in the middle of the screen for the user to change regions""."
"im2txt_combined","There is a text field for the user to type in the email","The text field is not in the center of the screen shot, it is more at the top.","By mentioning in the description that the screen shot displays the sign up page."
"im2txt_combined","None that I can see.","It''s unclear what they mean by buttons.","Setting up features for your automobiles GPS system."
"im2txt_combined","There are buttons at the bottom for signing up.","None but it could be more specific.","This is the welcome screen from which the user can log in or sign up."
"im2txt_combined","There are two fields- one for the email and one for password.","It is accurate but worded awkwardly and incomplete.","This is a sign-in page for Allstate where the user can enter their email and password to sign in or create an account."
"im2txt_combined","There is indeed a button in the top left that allows the user to go back","It lacks crucial information about the page itself, which is ""advanced settings"".","It should mention that the page allows the user to view and toggle the ""advanced settings"" of their internet browser."
"im2txt_combined","There is an e-mail entry area shown","The e-mail entry box is dimmed not focal","By mentioning that what is shown is progress for an unzipping"
"im2txt_combined","Images do appear on the screen.","What is presented is a keyframe of four albums not ""a scrolling list.""","By either describing what is shown (a keyframe of four albums), or substituting a capture of an actual image-scroller."
"im2txt_combined","at the bottom of the screen there is a button","The button says ""next,"" not sign in.","Change the button to read ""sign in."""
"im2txt_combined","not accurate - nothing","that there's a list of countries to scroll through- there's not","change the description to that there's a list of months/days/years to scroll and choose from"
"im2txt_combined","""the screen allows the user to do something","it does not allow the user to sign in","the screen describes what can be done by clicking on the hamburger icon."
"im2txt_combined","There is a button in the top left.","It is not the menu button, it is a back button.","By correctly identifying the button as a back button, or correctly identifying the menu button as being on the top right."
"im2txt_combined","It seems to be accurate if the proper field was shown.","The screen is showing a privacy sharing message - not an email entry field.","Show the correct screenshot, of an email entry field, or change the description to match what is being shown."
"im2txt_combined","the ""button"" that says OK will allow them to exit the screen","There is no actual ""button"". it just says OK.","remove the word ""button"""
"im2txt_combined","There is a button to escape the screen.","There are two buttons","Click the ""cancel"" button to escape"
"im2txt_combined","There could possibly be a space for an email address","No aspect of the description is accurate","Provide a description of the Privacy Statement and Terms of Use"
"im2txt_combined","The center of the screen contains a text field.","There are 2 text fields  to enter a username and password, not an email address.","Change the description to more accurately describe the text field and mention the fact that there are 2 text fields."
"im2txt_combined","Nothing, there is no menu in the top left.","There is no menu in the top left.","Actually describe what is in the screenshot."
"im2txt_combined","The top left of the screen is a back arrow showing one they are able to go back","There is nothing which explicitly says 'back'","There could be some definitive text which shows a user to go back."
"im2txt_combined","none","there is no button to select image","it can say there is a button to edit"
"im2txt_combined","none","in the center of the screen is a text field where the user inputs their email","In the center of the screen are four options for SMS Recovery Demo."
"im2txt_combined","There is some information on the screen","I see no arrow in the top left corner.","Provide an arrow to serve as a go back feature per the description or describe that it is actually a list of updates."
"im2txt_combined","Where the description tells you to enter the email","All of the information is accurate","None"
"im2txt_combined","In the center of the screen; email","a text field; user inputs their","In the center of the screen is a link to email support."
"im2txt_combined","None at all.","There is no button at the top right.","The description is not valid at all. It should mention that there are arrows at the bottom of the screen to view images and a cross at the top left to exit the screen."
"im2txt_combined","You can input something","It's not a text box for email. It's a date","Dont say theres a text box when there isn't one"
"im2txt_combined","There is a button in the top corner.","I don't think that button would have a menu below it.","Clarify what they mean by menu."
"im2txt_combined","It mentions that there is a button noticeable in the screenshot.","There is no button to exit the page or app.","The description can mention that the button is to sign up for the app, or below it to log in to the app."
"im2txt_combined","None of it.","All of it.","Accurately describing the screenshot."
"im2txt_combined","that there is a button that lets the user exit the current screen","not really in the middle of the screen","rephrase about button position"
"im2txt_combined","all of it","noe","it is ok as is"
"im2txt_combined","The description provided is completely inaccurate.","There doesn't seem to be a link at the top-left corner of this particular screen.","This is the ""Terms & Conditions"" page, and all relevant information pertaining to this topic--including links--are shown below. Press the arrow, located at the top-left portion of this screen, to return to the previous screen."
"im2txt_combined","There is a button in the middle of the screen.","There's an option to open a file.","Address the option to open the file."
"im2txt_combined","Nothing except there's something in the top left corner.","There is an arrow at the top left corner of the screen. It seems to me that by clicking it, the user would ""go back"" to a previous page (Comments).","By using proper grammar and punctuation and ensuring the information is accurate."
"im2txt_combined","none","there is no link","add a link"
"im2txt_combined","The next tab gets you to the next screen.","The next screen is confusing because it could mean next page and not that your exiting.","It should say exit or close tab instead of next"
"im2txt_combined","I don't see any accuracy in this description.","There is not a place on the screen for a user to input there email.","The description should say that the screen displays free Bible translation information."
"im2txt_combined","It is in the center of the screen.","There is no text field.","Say that there is a sign in button."
"im2txt_combined","none","everything; there is no search in the upper right corner","This screen shows healthy options to eat on the Fat Burn Pocket Workout"
"im2txt_combined","accurately tells user what to do","None","Add some elements to scroll down."
"im2txt_combined","There is a button at the bottom of the screen","There isn't a button to go back","Actually say what the button does"
"im2txt_combined","There is an image","This is a log in screen, not a gallery of images","Change description completely."
"im2txt_combined","That there is a button in the top left of the screen that performs a function for the user.","The button in the top left is a bell icon that will be used to remind the user of an event when clicked.","Mention that the icon is a bell, mention that its function is to remind a person of a stop, mention that the text and bell are white."
"im2txt_combined","I'm not sure that it is accurate- I don't recognize the center of the screen as a loading icon.","It may not actually be a loading icon.","It could be more specific."
"im2txt_combined","There is  a button on the screen.","The button on the screen is on the bottom right not the top right of the screen.","This could be improved by changing where the button is."
"im2txt_combined","You login using your email and password making it accurate.","It is not logging you into Facebook, but instead Care.com so it's misleading.","It could be clearer about what site you are being logged into and whether you could have a user name and PW instead of logging in by email or FB."
"im2txt_combined","None.","All of them.","The description needs to be totally changed as no text box is in the middle and nothing says anything about entering an email."
"im2txt_combined","There are links on the screen","There is no blue menu button, there is a login screen and multiple links to go back or register with white text","There is a login page with text boxes in the middle of the screen. A green button to enter once information is filled. A small link with white text to go back on the bottom"
"im2txt_combined","Nothing, this does not appear to be a game at all. Saying there is a button to start the game is nonsensical.","The entire description is inaccurate because this is not a game.","It should state that this is a screen that allows you to watch a video about the functionality of the app."
"im2txt_combined","all","none","can't improve"
"im2txt_combined","In the middle of the screen, there is somewhere where the user can input something","The description tells  me that the user can input their name there but the screenshot shows us that we can select a date/time","Change the description to 'the user can select a time period'"
"im2txt_combined","The description is accurate but is too wordy.","The description is accurate but can be condensed.","At the bottom left of display is the return button to exit current screen."
"im2txt_combined","The user dose input information into this screen.","This screen if for inputting dates not an email address.","This screen allows you to calculate your pregnancy due date."
"im2txt_combined","I'm not sure where the link button is in the top left corner?  Is it the words storage/emulated/0?","Seems like a link button is the one in the bottom right corner.  The top left corner doesn't look like a link button.","Not sure if this description is accurate?  The top left doesn't look like a link button.  Maybe describe what the button looks like more?  Maybe if it's the words 'storage/emulated/0' say that you click on that word instead of describing it as a ""button"""
"im2txt_combined","None, the caption does not describe present screen.","All... screen does not include a button at the bottom where one can sign in.","This is clearly a medical page, where one can view medications, due dates, med logs, and doctor notes, while keeping up with appointment times."
"im2txt_combined","There is a text field to enter your email address","The filed is at the top of the screen, not in the center.","By stating ""At the top of the screen is a text field where the user inputs their email address."""
"im2txt_combined","There is nothing accurate about the description","There is no where that you can exit out","By providing the right information."
